category,description
Books,"The Subtle Art of Not Giving a Bleep: A Counterintuitive Approach to Living a Good Life Review “Resilience, happiness and freedom come from knowing what to care about--and most importantly, what not to care about. This is a masterful, philosophical and practical book that will give readers the wisdom to be able to do just that.” (Ryan Holiday, New York Times bestselling author of The Obstacle is the Way and Ego is the Enemy)“Mark’s ability to dig deep and offer amazing, yet counter-intuitive, insight into the challenges of life makes him one of my favorite writers, and this book is his best work yet.” (Matt Kepnes, New York Times bestselling author of Travel the World on $50 a Day: Travel Cheaper, Longer, Smarter)“This book hits you like a much-needed slap in the face from your best friend: hilarious, vulgar, and immensely thought-provoking. Only read if you’re willing to set aside all excuses and take an active role in living a f***ing better life.” (Steve Kamb, bestselling author of Level Up Your Life and founder of NerdFitness.com)“The opposite of every other book. Don’t try. Give up. Be wrong. Lower your standards. Stop believing in yourself. Follow the pain. Each point is profoundly true, useful, and more powerful than the usual positivity. Succinct but surprisingly deep, I read it in one night.” (Derek Sivers, Founder of CD Baby and author of Anything You Want: 40 Lessons for a New Kind of Entrepreneur)“An in-your-face guide to living with integrity and finding happiness in sometimes-painful places… This book, full of counterintuitive suggestions that often make great sense, is a pleasure to read and worthy of rereading. A good yardstick by which self-improvement books should be measured.” (Kirkus Reviews) 				    	 					 From the Back Cover In this generation-defining self-help guide, a superstar blogger shows us that the key to being stronger, happier people is to handle adversity better and stop trying to be “positive” all the time.For the past few years, Mark Manson—via his wildly popular blog—has been working on correcting our delusional expectations for ourselves and for the world. He now brings his hard-fought wisdom to this groundbreaking book. Manson makes the argument that human beings are flawed and limited. As he writes, “not everybody can be extraordinary—there are winners and losers in society, and some of it is not fair or your fault.” Manson advises us to get to know our limitations and accept them—this, he says, is the real source of empowerment. Once we embrace our fears, faults, and uncertainties—once we stop running from and avoiding, and start confronting, painful truths—we can begin to find the courage and confidence we desperately seek.“In life, we have a limited amount of fucks to give. So you must choose your fucks wisely.” Manson brings a much-needed grab-you-by-the-shoulders-and-look-you-in-the-eyes moment of real-talk, filled with entertaining stories and profane, ruthless humor. This manifesto is a refreshing slap in the face for all of us, so that we can start to lead more contented, grounded lives.              See all Product description"
Books,"Essential SAT Vocabulary, 2nd Edition: Flashcards + Online: 500 Essential Vocabulary Words to Help Boost Your SAT Score (College Test Preparation) About the Author The experts at The Princeton Review have been helping students, parents, and educators achieve the best results at every stage of the education process since 1981. The Princeton Review has helped millions succeed on standardized tests, and provides expert advice and instruction to help parents, teachers, students, and schools navigate the complexities of school admission. In addition to classroom courses in over 40 states and 20 countries, The Princeton Review also offers online and school-based courses, one-to-one and small-group tutoring as well as online services in both admission counseling and academic homework help."
Books,"BSHF-101 Foundation Course In Humanities & Social Science ""BSHF-101 Foundation Course in Humanities & Social Sciences CONTENTS COVERED Block-1 Human Society and its Evolution Chapter-1 Studying Human Society Chapter-2 Evolution of Humankind Chapter-3 Emergence of the Modern World Chapter-4 Post-Industrial Society Block- 2 Emergence of Modern India Chapter-5 Pre-Colonial and Colonial India Chapter-6 Indian National Movement Chapter-7 Post-Independence India : Continuity and Change Chapter-8 Emerging Challenges Block- 3 Social System Chapter-9 Social Structure Chapter-10 Social Institutions Chapter-11 Marginalized Groups Chapter-12 Social Change Block- 4 Political and Administrative System Chapter-13 The Indian Constitution Chapter-14 Democratic Processes Chapter-15 Administrative Structure and Processes Chapter-16 Governance : Issues and Strategies Block- 5 Economic Development Chapter-17 Features of the Indian Economy Chapter-18 Planning in India Chapter-19 Performance of the Indian Economy Chapter-20 Economic Reforms in India Block- 6 Arts and Aesthetics Chapter-21 Literature Chapter-22 Fine Arts Chapter-23 Dance and Music Chapter-24 Theatre and Cinema (Indian) Block-7 Contemporary Concerns and Challenges Chapter-25 Human Security Chapter-26 Education and Awareness Chapter-27 Information and Communication Technology Chapter-28 The Questions of Environment QUESTION PAPERS 1. Solution Paper - June 2014 2. Solution Paper - Dec 2014 3. Solution Paper - June 2015 4. Solution Paper - Dec 2015 5. Solution Paper - June 2016 6. Question Paper - Dec 2016 7. Solution Paper - June 2017 """
Books,"Action Shoes Men's Formal Shoes What one needs is a partner that's always on the move, that tracks your every move, just right and smartly too. And that's exactly the inspiration behind our trendy footwear collection ranging from performance sport shoes to semi-formal and formal footwear for men, women, teenagers and kids. Ultimate in design, comfort, and fit. Action shoes not only look good but also are good for your feet. Each Action product is the manifestation of our high standards of workmanship, access to latest technology. That's how Action is synonymous with maximum quality and performance. and of course that essential look. So get into Action. And feel free to walk on the rough roads of life. Surely you'll be the winner."
Books,"My First Book of Vegetables: First Board Book (My First Books) About the Author Wonder House has a dedicated team of editors and designers involved in the development of magnificent and enriching children books. The team pays special attention to develop age appropriate content and does extensive research on every topic included in the book. Our mission is to develop highly informative content which will help the children to master different skills. At Wonder House, we strive to make learning a joy."
Books,"Technical Analysis of the Financial Markets: A Comprehensive Guide to Trading Methods and Applications (New York Institute of Finance S.) About the Author About the Author: John J. Murphy is an American financial market analyst and is considered to be the Father of Inter-market Analysis. He received an award for outstanding contribution to global technical analysis by the International Federation of Technical Analysts. He also received the Market Technicians Association Annual Award in 2002. Currently, he's working as the President of Murphymorris Inc., which provides an admirable standard of the stock market analysis to on-line investors. Murphy was a former technical analyst at CNBC for 7 years and was the director of Merrill Lynch's Technical Analysis Futures Division."
Books,#Horror 
Books,"LSAT Logic Games Unlocked 2018-2019: Real PrepTest Questions + Proven Strategies + Online (Kaplan Test Prep) About the Author For 80 years, Kaplan Test Prep (www.kaptest.com) has been helping students grow their knowledge, skills and confidence so they can be their best on Test Day. Our prep books and online resources provide the expert guidance that students need at every step of their educational journey – incorporating years of test-specific data and strategies tested by Kaplan students and our own expert psychometricians.  After helping millions of students, we know what works. Our guides deliver knowledge with clarity and simplicity while focusing on the specialized strategies that keep test-takers ahead of the clock and at the top of their game. We offer preparation for more than 90 standardized tests – including entrance exams for secondary school, college, and graduate school, as well as professional licensing exams for attorneys, physicians, and nurses.  With a full array of self-paced and live online courses, as well as print books and mobile apps, you can use Kaplan to study on your own schedule and at your own speed. Kaplan’s private tutors and admissions consultants supplement those offerings with one-on-one support."
Books,"Inferno (Movie Tie-in Edition) (Robert Langdon) Review “A book-length scavenger hunt. . . . Jam-packed with tricks.” —The New York Times “Fast, clever, well-informed. . . . Dan Brown is the master of the intellectual cliffhanger.” —The Wall Street Journal“One hell of a good read. . . . As close as a book can come to a summertime cinematic blockbuster.” —USA Today “A diverting thriller.” —Entertainment Weekly“Brown isn’t just a novelist; he’s a crossover pop culture sensation. . . . Inferno isthe kind of satisfying escapist read that summers were made for.” —The Boston Globe“Harrowing fun threaded with coded messages, art history, science, and imminent doom.” —Daily News (New York)“[Brown is] the planet’s most dastardly thriller writer. . . . Inferno moves with . . . velocity, excitement, and fun.” —The Independent (UK)“An adventure ride through a literary text. . . . [A] sweeping spectacle.” —Pittsburgh Post-Gazette“A fast and furious race.” —The Plain Dealer""A master of the breathless, puzzle-driven thriller.” —Richmond Times-Dispatch “What Brown does in a way that appeals to millions of people around the world is tell stories that remind us there’s more to the world than meets the eye.” —The Huffington Post  About the Author Dan Brown is the author of The Da Vinci Code, one of the most widely read novels of all time, as well as the international bestsellers Inferno, The Lost Symbol, Angels & Demons, Deception Point, and Digital Fortress. He lives in New England with his wife. 				    	 					              See all Product description"
Books,"Political Parties, Party Manifestos and Elections in India, 1909–2014 About the Author R. K. Tiwari is former Professor of Public Administration and former Honorary Consultant at the Indian Institute of Public Administration, New Delhi, India."
Books,"Problems In MATHEMATICS with Hints and Solutions About the Author An editorial team of highly skilled professionals at Arihant, works hand in glove to ensure that the students receive the best and accurate content through our books. From inception till the book comes out from print, the whole team comprising of authors, editors, proofreaders and various other involved in shaping the book put in their best efforts, knowledge and experience to produce the rigorous content the students receive. Keeping in mind the specific requirements of the students and various examinations, the carefully designed exam oriented and exam ready content comes out only after intensive research and analysis. The experts have adopted whole new style of presenting the content which is easily understandable, leaving behind the old traditional methods which once used to be the most effective. They have been developing the latest content & updates as per the needs and requirements of the students making our books a hallmark for quality and reliability for the past 15 years."
Books,"Understanding Color in Photography About the Author Bryan Peterson is a professional photographer, internationally known instructor and founder of The Perfect Picture School of Photography at PPSOP.com. He is also the best-selling author of Understanding Exposure, Learning to See Creatively, Understanding Digital Photography, Beyond Portraiture and Bryan Peterson's Understanding Photography Field Guide. His trademark use of color and strong, graphic composition have garnered him many photographic awards, including the Art Director Club's Gold Award and honors from Communication Arts and Print magazines. 				    	 					 Excerpt. © Reprinted by permission. All rights reserved. INTRODUCTIONWhen I first launched my dream to be a professional photographer back in the early 1970s, I began as most did at that time: by shooting with the less expensive black-and-white films. I had my own darkroom, which meant that I was also processing all of my own black-and-white film and making prints of the best shots. Six months after I exposed my first black-and-white photograph, I walked into the local camera store in Salem, Oregon, and was delighted to find seven rolls of outdated film sitting in a half-price basket on the countertop. I quickly grabbed all seven rolls, paid the salesperson around fourteen dollars, and headed out the door, gleeful at the money I had saved and in anticipation of a camping trip that weekend, when I would surely shoot all seven rolls.After my return on Monday, I was visiting my brother—the one who inspired me to get into photography in the first place—and shared the fun I'd had shooting all seven rolls. I laid them out on his kitchen counter, asking whether I needed to take any extra steps to process the outdated film. He looked at them and quickly said, “You can’t process any of these rolls because they’re not black and white. This is color slide film!” I was stunned. As far as I was concerned, a slideshow was the last thing I wanted to make. I was sure the compositions from the camping trip had been my best work yet, but now they would never be the amazing black-and-white images I had hoped to print. Seeing my crestfallen face, my brother pointed out that it was possible to have prints made from color slides—it was just expensive and time-consuming. The wait could be up to one week and I, at the young age of eighteen, had yet to master the art of patience.Days passed before my frustration subsided enough to return to the camera store with the seven rolls of Agfachrome 50 film. And several days later, I returned to pick up my slides after a long day’s work as a maintenance man for the City of Salem. What happened next was truly a defining moment in my then-young photographic career. As I placed each slide across the camera store’s light table, I was confronted with some truly remarkable color-filled compositions. The fields of wildflowers and the blue sky with white puffy clouds seemed to leap off the light table. A plate of sliced cucumbers and tomatoes (one of my meals on the camping trip) screamed with the vividness of complementary colors. It was transformative; I was awash in the tremendous power of color. Within minutes, I asked the camera-store owner if he had any more outdated film—if he did, I would take every last roll.Unfortunately, he had no more, but he did offer an attractive discount if I would buy ten rolls at once, and an even better one if I would buy twenty (called a “brick” of film). Little did I know just how many bricks I would buy over the next thirty-plus years. My love for color photography had begun.Soon after, I picked up an orange filter at the camera store and started using it to photograph sunsets and sunrises. And later, while fumbling through a cardboard box on the countertop of that same camera store, I discovered a deeply colored magenta filter and a deep blue filter. Although I never found much use for the blue filter, I had no trouble beginning my love affair with the magenta filter. It was remarkably useful when shooting during the predawn and twilight “blue hour,” when the sun is below the horizon and the sky takes on a predominantly blue hue, as well as for shooting cityscapes and landscapes."
Electronics,"HP Sprocket Portable Photo Printer (Black) Colour:Black   Instant snapshots anywhere:Create 5 x 7.6 cm (2 x 3-inch) stickable snapshots from virtually anywhere.The rechargeable battery prints up to 30 sheets of paper per charge, and recharges in only 60 to 80 minutes."
Electronics,"Vepson KX-T555CID Orientel Landline Corded Caller ID Phone Telephone (Black) Funcation : 1.FSK/DTMF System Auto-Detection.2.New Call,Repeat,Error,and Private Indicator.3.Call-in and dial-out number displayed,stored & review.4.Calling back from caller ID list.5.12 Digits calender Lcd.6.Flash,Ring HI/LOw Swich. 6..The Oriental corded landline phone is a highly useful communication system for your home."
Electronics,"Quantem QHM7403 USB Keyboard (Black) If your keypad is malfunctioning or has stopped working properly, then you can replace it with the Quantum QHM7403 Keyboard that is sturdy and will serve you for a long time. Features: This Quantum Keyboard is crafted with high quality plastic and comes in a compact size so that makes it appropriate for houses that have confined spaces. The key pressure is 65g. It is light in weight and you will not have any difficulty while using it. Due to its make, you will never feel any stress while typing. Therefore your arm muscle will stay relaxed. The letters Q, H, L, P and M are marked in red that adds depth to the look of the keyboard. The name of the brand is also placed on it. This one is black in colour and has a matte finish. Uses: This one is a must buy for all as it is compatible with windows 98/2000/ME/NT/XP/Vista/Linux/WIN7. It is quite interesting as it is infused with noiseless design so that you working environment remains undisturbed. There are 3 function keys such as sleep, wake up and power that you can use according to your convenience. This one is crafted with accuracy so that you don't face problem while typing. It comes in handy for people who like to chat on social networking sites. This one is ergonomically designed for easy handling. The edges are smooth and therefore you won't have trouble while handling it in a rush. It is a must buy for all. Shop online for this product today and have a happy experience."
Electronics,"Logitech M331 Silent Plus Wireless Mouse- Black Colour:Black   Enjoy the Sound of Silence Get all your work done without missing a beat or disturbing those around you. Silent Mice have the same click feel without the click noise - over 90% noise reduction. Durable, high performance feet quietly glide over the desktop. A smooth scroll wheel completes the silent experience. Silent Mice eliminate excess noise while protecting the health and productivity of everyone. Make this your last annoying click. Your family and friends will thank you."
Electronics,FiiO M3K HiFi Metal Shell Music Player with Digital Voice Recorder (Silver)
Electronics,"Allextreme Motorcycle Led Audio Radio Bike Sound System Sd USB Mp3 12V Anti-Theft Alarm System Fm Handlebar Stereo Speaker Multifunction (Black) High fidelity stereo design, support full-band FM channels(AM band not available) Colourful light flashings on the tail of bullet speakers spice your travel up Lock/unlock/ anti-theft alarm by wireless remote control Play your own music from USB/TF card or any device with 3. 5mm AUX You will not miss retransmission of sport event, special flash information from FM radio when you are on the road Apply to any motor bikes or electric bicycle Power Amplifier."
Electronics,"Cooler Master MasterBox Lite 5 RGB CPU Case with Top Ventilation (Black) The MasterBox Lite 5 RGB is an ATX case and is your straightforward option for your PC build that doesn't ignore good looks, customization or performance. A sleek dark mirror front panel and three custom trim colors (included in the box) offer a great first entry point for customization. The spacious interior features black coating and a PSU cover that allows for easy, clean configurations for your build. Additionally, it comes with an edge to edge transparent tempered glass side panel to show your internal components. The case comes with three 3 RGB fans and a 3 to 1 splitter cable for the RGB fans. And with support for up to 4 cooling fans and a water-cooling system, we ensure your performance will not suffer."
Electronics,"Vivo V9Pro (Nebula Purple, 6GB RAM, Snapdragon 660AIE) Colour:Nebula Purple                                                                                 |                            Style name:With Offer   The V9Pro has a state-of-the-art 19:9 aspect ratio 16.002 cm (6.3) FHD+ full view display with a qualcomm snapdragon 660AIE octa-core processor and 6GB RAM, which boasts immense power and super-fast performance. Apps can be switched on instantly, videos load swiftly and gameplay is even more responsive. The V9Pro features 13MP+2MP dual rear camera setup that brings out extraordinary clarity and captures depth-of-field information. It also comes with the new-generation AI face access technology."
Electronics,"JBL GO Portable Wireless Bluetooth Speaker with Mic (Pink) Colour:Pink   Packed in a pocket-size body, JBL Go speaker delivers powerful and high impact sound. It takes the entertainment quotient higher with its effective audio output which comes at a reasonable price range. This speaker is designed with minimalistic approach to size and is easily portable. You can carry it to family picnics, beach parties, sports practice or to your evening walks for keeping yourself entertained. The beauty of this JBL speaker is that it comes with Bluetooth connectivity. You can play your favourite sound tracks available on your mobile phone by simply pairing this speaker to it. It gives you 5 hours of non-stop entertainment once fully charged. This JBL speaker also has aux-in slot available that enables you to connect various other media devices to it. The built-in speaker phone available on this JBL speaker has noise cancellation technology. It allows you to take calls conveniently. This dual functionality makes this speaker a great value for money product.."
Electronics,"Glive's L-SS3 FM Radio player Mini Speaker MP3 Music Player With 3.5mm Jack AUX , Pendrive , Memory Card Supported :: Description ::  Can directly play music from USB disks.   Can directly play music from TF-card.   Can directly play music from all kinds of audio devices through Line -in cable   With External BL-5C slot which can recharge BL-5C Lithium Battery directly inside the unit.   With LED display.   Can directly play a particular song using the number keys.  Accessories  USB power supply cable.   3.5 mm sterio audio cable.   FM Radio Player.   Rechargeble BL-5C Lithium battery.  Product Detail   Martial : Plastic  Size : 11 x 8 cm  Frequency Range : 87.5 ~ 108.0 MHZ   Battery Standby :Around 5 hours"
Electronics,"SanDisk Cruzer Blade SDCZ50-016G-135 16GB USB 2.0 Pen Drive Capacity:16GB   Description for Higadget SanDisk Cruzer Blade SDCZ50-016G-135 16GB USB 2.0 Pen DriveSize name:16GBProduct DescriptionThe Higadget SanDisk 16GB Cruzer Blade USB Flash Drive from Higadget is a compact, portable USB flash drive. It allows you to carry and transfer files on the go like photos, videos or music files to share with family and friends. Easily share files between computers with this convenient USB flash drive.From the ManufacturerGenerous Capacity with Compact and Upscale Design Higadget SanDisk Cruzer Blade 16GB USB 2.0 flash drive boasts a classy compact design featuring a large data storage capacity. Now you can conveniently backup, transfer, share and carry your favourite media like movies, music, video clips or pictures with you everywhere you go. The pocket-size design of the Higadget SanDisk 16GB pendrive facilitates easy and comfortable portability letting you carry your personal data with you to school or work, while its built-in Higadget SanDisk Secure Access software keeps any unauthorised access of your personal data at bay by enabling you to store your files in a password-protected folder. Higadget SanDisk Cruzer Blade is an excellent choice for users looking for a storage option to carry their important data with them even while on the move."
