category,description
Electronics,"Tagg Inferno, Wireless Bluetooth Earphone With Mic + Carry Case (Black) Enjoy TRUE HD SOUND: TAGG Inferno wireless headphones comes with Bluetooth 4.1 CSR technology, AptX and cutting edge components, delivers superior sound quality and power to move you. Enjoy guitar solos, treble and strong bass like you're listening live. 
 Combined with a IPX4 Sweat/Dust/Splash Resistant design, these elegant earphones bring the beauty of music into your everyday life. Whether you’re out for running or on your daily commute, TAGG Inferno wireless earbuds deliver outstanding signature sound to suit your current activity.
 Submerge yourself in the limitless world of sound with the latest in Bluetooth innovation
                               Music the way it should be  Bluetooth 4.1 technology features stable signal transmission, clearer sound quality and low power consumption.  You can enjoy clear sound from these earbuds during running and other sports activities.           Noise Cancellation:  Featured with CVC 6.0 Noise cancellation technology, these earbuds filters out background noise to guarantee high quality sound and provides you clearer voice calls. Advanced noise reduction quells airplane cabin noise, city traffic or a busy office. So you can focus more on what matters—your music, movies and videos.          Never Falls Out:  The comfortable and ergonomic design ensures that earphones always stays in place while running, jogging and gyming. TAGG Inferno comes with three sizes of earbuds to provide you the best fit.       Longer Listening:   100 mAH in-built rechargeable lithium Ion battery provides upto 7 hours of music play time and 180 hrs of standby time. Now, run a marathon or simply jog to the shop, there's more than enough time before needing a recharge. When these earbuds run out of juice, power them up again with a USB port on your laptop, car charger, or wall charger.        Hands-Free Calling:  Answer and reject calls as you dash around the track. Built-In microphone with CVC 6.0 Noise cancellation technology reduces outside noise and transmits your voice with enhanced quality. Long lasting battery provides the talk time of 8-9 hrs and Bluetooth Version 4.1 ensures the stable signal transmission. Enjoy hands-free phone conversation, take Skype/Video Conference Calls.                       About the Startup        Describe your product in 3 words. Powerful Music Assistant   How did you come up with the idea for this product? In a world filled with overpriced and often underwhelming audio products, our key focus has always been on how to deliver an exceptional wireless audio experience for those who are always on the move and demand the best quality.   What makes your product special? From cutting-edge bluetooth wireless technology, to innovative material and sound design, remarkable battery life and customer service like you've never had before - TAGG Inferno is built to put a smile on your face, day in and day out.
 In our business model, we are practically listening to our consumers. From ergonomic design to the perfect balance of bass and treble, TAGG Inferno is designed to provide the best wireless experience.
    What has been the best part of your startup experience? In this dynamic start-up industry, we have to improve every aspect of business i.e. marketing, finance, product, human resources etc. Listening to customers’ feedback and appreciation serves as motivation to improve every day and makes all the effort worthwhile."
Electronics,Terabyte IEC Mains Power Cable (Black) A High Quality Fully Moulded 3 pin India 10 amp 250V plug to IEC socket. This is used for powering a monitor or PC and a whole host of other PC Equipment like printer. The plug comes fully tested . This plug is ROHS compliant ensuring the highest material standards in India 1 m long black color.
Electronics,"HP S700 500GB 2.5-inch Internal SATA Solid State Drive (SSD-S700-2.5) Capacity:500GB   HP SSD S700 series delivers compact storage and optimized performance for traditional and innovative small-form-factor and embedded platforms. The case 2.5-inch SSD design has a significantly smaller footprint than a 2.5-inch hard disk drive (HDD) and enables fast read/write access times and a significant I/O and throughput performance improvement as compared to HDDs. This design makes it ideal for new and innovative small form factor computing platforms that have size and weight requirements that traditional 2.5-inch HDD s cannot meet; such as, notebook, thin-and-light systems, mini-and sub-notebooks, all in-one computers and embedded platforms."
Electronics,"Dell Inspiron 13 2-in-1 Laptop: Core i7-8550U, 256GB SSD, 8GB RAM, 13.3"" Full HD Touch Display, Windows 10 Dell 5379 13.3"" i7 8th gen 8gb 256gbssd Core i7-8550U, 256GB SSD, 8GB RAM, Full HD Touch Display, Windows 10"
Electronics,"Ahuja Speaker 50Watts Outdoor/Indoor Speaker Srx 50Dx, 2-8Inch Speakers With 2 Meters John Barrel, Weather Resistance Speaker Cable A compact general purpose speaker column using two Full Range Dual Cone 8"" speakers, reproducing a clean undistorted sound for both speech and music. The system is housed in a Rugged Closed Box Enclosure made of 12mm medium density fibre board, and has a durable black shock resistant paint finish. SRX-50DX has nominal impedance of 16W, SRX-50XT operates on 100V line with three power taps selectable through a rotary switch."
Electronics,"Lambent Magnetic Wireless Bluetooth Earphones Headset with Mic for Handsfree Calling for All Smartphone Devices Size name:Red magnetic headset     Colour:-Red  Wireless Bluetooth 4.1 Magnetic Sports Stereo Headset Its light Weight, Sweat-proof and Noise-reduction. If you connect an iPhone, you can display the remaining power of the Bluetooth headset on the iOS system so that you can charge it. Built-in magnet switch, when the magnet is separated/attracted, intelligently predicts your needs, without any key operation. You can connect two headphones together when it not be used and can be worn like a necklace on your neck, which is a convenient way of carrying. Our headphones are equipped with a waterproof nano-coating that protects against sweat for life. The ergonomic earhook secures the earphones in the ear without falling. Perfect for running, hiking, yoga, gym, fitness, travelling and Sports bluetooth headset, with HD music playing, listening to music and other audio when doing exercise compatible Bluetooth 4.0, you can connect the headset easily with the phone. Weighting only 0.6 oz and coming with interchangeable ear buds and hooks, the headset will stay easy on your ears even when you are moving around. Features Bluetooth Range: 10M Bluetooth Version: 4.1 FEATURES: # It is compatible with various of Bluetooth phones # You can connect two headphones together # Elegant with stylish design # Excellent Audio Output in terms of sound standard   1 Year Warranty on Manufacture Defect."
Electronics,"BEESCLOVER 10 Pcs Universal Paper 3D Glasses View Anaglyph Red/Blue 3D Glasses for Movie Video Description: Item type: Paper 3D Glasses Applicable: 3D (Red and CYAN) viewing on internet, DVDs, VHS tapes and broadcast TV (anaglyph) Color: As shown Size(L*W): 14.5x3.8cm/5.7x1.5inch Features: Lightweight, portable, easy to use Material: Cardboard Package includes: 10 * Paper 3D Glasses Note: The colors deviation might differ due to different monitor settings. We provide you with the best product and service, if you have any problem, please let us know, and we will solve the problem ASAP. Thank you so much."
Electronics,"boAt Rugged V3 Braided Micro USB Cable (Molten Orange) Colour:Molten Orange   The boAt lifestyle rugged Micro USB cables are really rugged and made to be compatible with your all micro USB devices. No warning message, works the same as the cable you get with your device. Connects to your Smartphones, Mp3 Players or other micro USB supported devices and charges or syncs by connecting the USB connector into your wall charger or computer. Fully supports data sync and battery re-charging for any micro USB device. No need to wrap, the cable design makes them tangle free. Choose your style to charge in. Plug it in, plug into Nirvana."
Electronics,"Quick Heal Antivirus Pro - 1 PC, 3 Year (CD/DVD) Style Name:1 Device, 3 Years (CD/DVD)   Product Description For Technical Assistance, please contact - 18001217377, Email - info@quickheal.co.in 				    	 					 From the Manufacturer    Advanced DNAScanThe ingenious Quick Heal DNAScan technology is now enhanced to combine behavioral and characteristic inspection and monitoring of unsafe programs. This results in a clean, more up-to-date and accurate detection of threats. Improved Scan EngineThe revamped antivirus scan engine avoids rescanning files that have not been altered since the previous scan. This reduces system resource usage.  Browser SandboxRunning your web browser in Sandbox Browser gives you an uninterrupted and secure browsing experience. It provides internet security protection by acting like a screen between the PC's operating system and the malicious threats. This feature now comes with a USB drive support.  Vulnerability ScannerHelps you identify and fix security vulnerabilities on your PC that can expose your computer and its data to attackers.   Web SecurityReal time cloud security restricts access to malware infected websites. This feature gives internet security protection by blocking threats transferred through websites hosting malicious codes.    Core ProtectionThe intelligent antivirus engine effectively detects and resolves threats (viruses, worms and other malware). The additional features like AntiSpyware, AntiMalware, AntiRootkit, Silent Firewall and IDS/IPS provide all round virus protection.  Email SecurityQuick Heal AntiVirus Pro gives cloud-based email security that prevents infected emails from reaching your Inbox. TrackMyLaptopLost or stolen laptops can be a huge liability to your privacy. Quick Heal TrackMyLaptop Service helps track the whereabouts of your lost or stolen laptop. The service is a social initiative that comes with every desktop product of Quick Heal at no extra cost.   Quick Heal Remote Device Management (RDM)The RDM portal lets you manage your Quick Heal products. Via the portal, you can view the security status of the products, renew, and manage their licenses. Stay ConnectedOur users now have direct access to our Facebook and Twitter pages with just a click.   Safe Mode ProtectionThis facility stops unauthorized users from changing Quick Heal security settings when the system is running on Safe Mode.  Enhanced Self-ProtectionThe Self-protection feature now protects Quick Heal's running processes and services.     Import and Export SettingsUsers can now import Quick Heal security settings from a single computer and export it to other computers. This is helpful in cases where reinstallations or multiple computer configurations are concerned.  FirewallAllows you to set protection levels for Internet traffic and applications that try to connect to your network. It also includes Stealth Mode that makes your system invisible to malicious threats. Silent ModeSuppresses prompts across all Quick Heal antivirus modules thereby reducing system load and allowing uninterrupted PC usage.  Flash Drive ProtectionBest antivirus automatically scans external storage devices. Protects USB drives from autorun infections.        AntiVirus ProInternet Security EssentialsAntiVirus Server EditionInternet SecurityTotal SecurityAdvance DNAScan  ✓ ✓ ✓ ✓ ✓ Core Protection Anti virus ✓ ✓ ✓ ✓ ✓  AntiSpyware ✓ ✓ ✓ ✓ ✓  AntiMalware ✓ ✓ ✓ ✓ ✓  Anti - Rootkit ✓ ✓ ✓ ✓ ✓  Firewall ✓ ✓ ✓ ✓ ✓  Intrusion Detection ✓ ✓ ✓ ✓ ✓  Intrusion Prevention ✓ ✓ ✓ ✓ ✓ Mail Protection: Spam protection   ✓ ✓ ✓ ✓ Internet Protection Browser Sandbox ✓ ✓  ✓ ✓  Safe Banking  ✓  ✓ ✓  Phishing Protection  ✓ ✓ ✓ ✓  Web Security    ✓ ✓  Parental Control    ✓ ✓ Vulnerability Scan   ✓ ✓ ✓ ✓ Virtual Keyboard   ✓  ✓ ✓ Privacy Protection: Data Theft Protection    ✓  ✓ PC Optimization Registry Cleanup     ✓  Disk Cleanup     ✓  Traces Cleanup     ✓  Registry Defragmenter     ✓  Duplicate File Finder     ✓ Mobile Phone Protection PC2Mobile Scan     ✓"
Electronics,SHOPEE 58mm Replacement Front Lens Cap for Canon 5d/650d/ 1100d/ 600d/700d/1200d/1300d with 18-55mm & 55-250mm Lens 58mm center pinch lens cap for canon it is used to protect lens brand new third party canon center-pinch front lens cap. specifications*perfect fitting replacement cap keeps your camera lens clean and protected * remarks: this lens cap is designed for canon and made by third party (not original canon lens cap)
Electronics,"ZAAP ULTRA SLIM Bluetooth Universal Keyboard for iPad Air 2/Air/iPad Pro/iPad mini 4/3/2/1/iPad 4/3/2/iPhone 6/Apple iPhone 7/Android Devices (Silver) #productDescription .aplus-3p {width: 970px} .aplus-3p ul {overflow: hidden;} .aplus-3p ul li {list-style-position: inside;} #productDescription .aplus-3p table {border-collapse: collapse !important; width: 100% !important} #productDescription .aplus-3p .one-col {width: 100%; margin-bottom: 1em} #productDescription .aplus-3p .one-col .image-wrapper {margin-bottom: 1em} #productDescription .aplus-3p .leftImage {margin-bottom: 0} #productDescription .aplus-3p .leftImage.image-wrapper {max-width: 300px;} #productDescription .aplus-3p .image-wrapper img {max-width: none;} .aplus-3p .image-wrapper {display: inline-block; text-align: center} #productDescription .aplus-3p .image-caption {font-size: 0.9em; margin-top: 5px} #productDescription .aplus-3p table tr {vertical-align: top;} .apcs-eventhirdcol {width:300px; display:block;} .apcs-eventhirdcol-table {width: 100%; border-collapse: separate;} .apcs-eventhirdcol-table th {text-align: center; vertical-align: top;} .apcs-eventhirdcol-table tr td {vertical-align: top;} .apcs-eventhirdcol-table tr td:first-child {padding-right: 17px;} .apcs-eventhirdcol-table tr td:first-child + td {padding: 0 17px;} .apcs-eventhirdcol-table tr td:first-child + td + td {padding-left: 17px;}  ZAAP ULTRA SLIM Bluetooth Universal Keyboard     ZAAP Ultra Slim Bluetooth Keyboard works equally well with iOS, Android, and Windows, with shortcut keys optimized for all four systems. Advanced Bluetooth version ensures upto 33 Feet wireless connectivity. Rated among best new keyboard designs by AppleRx 2017. 30% smaller than traditional clunky keyboards and as light as a billiard ball (6.7oz). Save more space on your desk or in your bag! Enjoy quick, quiet typing on this comfortable keyboard. Shortcut keys save you time launching tasks or controlling media. Long Battery Life With replaceable AAA batteries and power-saving mode, this keyboard lasts for more than 3 months at a time.     DISCOVER FREEDOM : ZAAPZAAP was built out of respect for complete digital freedom for customers in USA & rest of the world. We seek to change the way you live, work and play with your mobile electronics. As industry leader & # 1 brand ZAAP has consistently led the charge to introduce lifestyle-driven design and innovative technology to enhance the customer experience.  We have been featured worldwide at high-profile Tech shows, Sporting events ,music festivals and more. Do Good-Every purchase you make we contribute portion of sales towards child education.SMART DESIGN SMART FEATURES             SMART DESIGN SMART FEATURES    Ultra Compact design save more space on your desk or in your bag Comfortable keys matte finish low-profile keys ensure smooth and quiet typing. Works equally well with iOS, Android, and Windows. 3 million keystroke life span. Shortcut keys save you time launching tasks or controlling media. This keyboard lasts for more than 3 months at a time. With replaceable AAA batteries and power-saving mode Use high quality chipset supplied by Broadcom USA, quickly connecting, stable and saving power.  DISTINCTIVE PREMIUM FEATURESCOMPACT & LIGHT 30% smaller than traditional clunky keyboards and as light as a billiard ball (6.7oz). Save more space on your desk or in your bag.  USA BROADCOM BLUETOOTH VERSION Use high quality chipset supplied by Broadcom USA,quickly connecting, stable and saving power. This ensures upto 33 Feet wireless connectivity.CROSS-COMPATIBLE: Works equally well with iOS, Android, and Windows, with shortcut keys optimized for all four systems. NOTE: This keyboard is not compatible with Mac OS X El Capitan.  LONG BATTERY LIFE: Lasts over three months (based on two hours use per day) with power-saving mode and space for two AAA batteries (not included).  SILVER FINISH Made of silver finish for superior rigidity, anodized matte process creates excellent sense of touch. COMFORTABLE KEYS Enjoy quick, quiet typing on this comfortable keyboard. Shortcut keys save you time launching tasks or controlling media.  NOTE:Press FN and Q,W or E keys together to shift between Android,Windows or iOS after connected successfully Otherwise the keyboard's funciton key will be invalid.  WHAT YOU GET 1 x ZAAP Ultra Slim Bluetooth Universal Keyboard , User Manual, Welcome Guide."
Electronics,"Sony MP-CD1 Compact Pocket Size Mobile Projector (Black) Super-convenient portability & Compact and light weight premium aluminum design as Put on a show anywhere, anytime. 105 ANSI lumens/DLPR IntellibrightTM technology designed to intelligently manage image brightness & Power consumption. Short Throw- Display your content on a screen, up to 120” at a 11-foot throw distance"
Electronics,"4"" x 18 LB Heat Stabilized Nylon Cable Ties (100/bag) - Black Electronics > Electronics Accessories > Cable Management > Wire Cable Ties, Electronics > Electronics Accessories > Cable Management, wire ties, zip ties, cable ties, wire ties, zip ties, cable ties"
Electronics,"AmazonBasics USB 2.0 Cable - A-Male to B-Male - 6 Feet (1.8 Meters),Black Size name:6 Feet   The AmazonBasics USB 2.0 A-Male to B-Male Cable with Gold-Plated Connectors gives you full performance with many USB devices."
Electronics,"PanaCast Panoramic 4K Resolution USB Camera The PanaCast 2 video collaboration camera from Altia Systems: Panoramic-4K video camera that allows remote teams to participate in immersive video conference calls, making them feel like they’re in the room. Host smoother meetings that provide higher productivity, without all the annoying hassles of typical video conferencing cameras. Everyone is in the frame all the time, eliminating the typical ""Who just said that?"" and ""Who is there with you?"" questions. Look around. See everything. You are in the room with the PanaCast 2. It's that simple."
Electronics,HITSAN INCORPORATION Zomei Filtro Ultra Slim Frame GND Colour Graduated Filters Blue/Grey/Red/Orange 49 52 55 58 62 67 72 77 82mm for DSLR Camera Gradual Orange Caliber 52mm Package:Yes; Brand Name:Zomei; Type:Colour Graduated; Type:Colour Graduated;
Electronics,"Sony HDRCX405 9.2MP HD Handycam Camcorder with Free Carrying Case (Black) Size:Camcorder   Create clearer memories with Full HD/60p and Optical SteadyShot image stabilization. Every moment you capture benefits from a 26.8mm wide angle ZEISS lens and 30x Optical / 60x Clear Image Zoom. Easily charge or transfer files with the built-in USB cable, and automatically create highlight videos from multiple clips in MP4 for easy sharing."
Electronics,"Dell 2018 Inspiron 15 5000 Flagship 15.6inch Full HD 2-in-1 Touchscreen Laptop Core i5-8250U, 8GB, 1TB, Backlit Keyboard, Windows 10 Expertly designed with a 360-degree hinge, the Dell Inspiron 15 flips the view between four different modes: tent, stand, laptop, and tablet. It's equipped with the best and brightest in Windows features and a 15.6-inch display that offers plenty of room for work and play. The 8th Gen Intel Core i5 processor keeps things humming smoothly no matter what you throw at it. And the massive 1TB hard drive means you have loads of space for all your digital stuff."
Electronics,"Taslar Go Pro Underwater Housing Waterproof Case Diving Protective Shell Accessories Replacement Cover with Bracket for GoPro Hero7 Black 2018, Hero 6, Hero 5 Action Camera With the use of Taslar waterproof case, you can record activities even 45m under water and it won't damage the shooting effect, clear and vivid."
Electronics,"iBall Slide Elan Tablet (10.1 inch, 32GB, Wi-Fi + 4G LTE + Voice Calling), Matte Black Colour:Matte Black                                                                                 |                            Size name:3x32   Powerful quad core 1.3 GHZ arm cortex A53 64bit processor, 3 GB ram, 32 GB built-in storage, full capacitive multi-touch, 25.5cm (10.1) display, IPS HD screen resolution (1280 x 800), slim and attractive design."
Electronics,"Digisol DG-KU1004 Mini USB KVM Switch with Audio Support, 4 Port Digisol 4 Port Mini USB KVM Switch with Audio Support is allows control of up to four computers from a single set of keyboard, monitor and mouse. It also allows the users to use a single set of external Speaker and Mic for connecting up to four computers. Thus, this device reduces the number of devices on the desktop and the clutter caused by the cables connecting these devices. The Digisol DG-KU1004 uses a highly flexible -flex technology for switching. This flexible technology allows the user to switch the set of Keyboard, Monitor and Mouse and set of Speaker and Microphone independently. By this, the set of Keyboard, Monitor and Mouse can be connected to one Computer, while the Speaker and Microphone can be connected to another computer. In addition the set of Keyboard, Monitor and Mouse and the set of Speaker and Microphone can also be switched simultaneously from one computer to another. This flexibility helps in seamless multimedia experience. When all the PCs connected to the KVM switch are powered down, the DG-KU1004 also shuts down itself. The KVM switch derives the required power from the USB interface. Thus, no external power source is required to power the KVM switch. The DG-KU1004 uses a unique integrated Cable/Connector design. The Combo Cable/Connector design eliminates the requirement of individual cables for connecting the Keyboard, Monitor and Mouse ports from the PC to the KVM switch, which further reduces the cable clutter. The DG-KU1004 is usable out-of-the-box. Only the KVM cable and Speaker/Microphone cables need to be connected for the operation of the switch. No software installation or configuration required for normal operation."
Electronics,"Terabyte Generic 3 Port HDMI Switcher Splitter Switch Box (Multicolor) High quality made of gold-plated connectors and top-notch material, the switch will give you stable performance. No distortion of audio and video. Easy to use no extra power needed and no installation required. This switch allowsplug and play. High resolution resolution up to 4k and it supports 480i, 480p, 576p, 720p, 1080i,1080p too. Hdmi switch will be a perfect companion for anyone who wants to get more hdmi ports on their tv. 3 hdmi in and 1 hdmi out design helps connect to more hdmi devices and it supports recognizing function and manual switch."
Electronics,"Ikall N4 Tablet (7 inch, 16GB, 4G + LTE + Voice Calling), Black Sales Package: Tablet, earphone, charger, user manual, 4g Volte supported; Operating system: Android 6. 0 marshmallow, 1. 3 Ghz quad-core processor, 7 inch display, 1024 x 600 pixels resolution; Camera: 5mp primary camera, 2mp secondary camera, dual sim, 3000 mAh lithium-ion battery capacity; Memory: 1GB RAM, 16GB internal memory which can be expandable upto 32GB;1 year warranty."
Electronics,"Lenovo K8 Note (Venom Black, 4GB RAM, 64GB Storage) with New System Update The Lenovo K8 Note is the most power Killer Note ever. Experience a new level of performance with a 10-core processor plus up to 4GB of RAM and 64GB of storage. K8 Note comes with 2 parallel rear cameras with 13MP and 5MP depth sensors to capture DSLR-like depth of field effect. Take amazing selfies with high resolution 13MP front camera with party flash. Enjoy an immersive multimedia experience with 13.97cm (5.5) Full HD Display with Dolby Atmos support. K8 Note ships with the stock Android 7.1.1 Nougat for a smooth and responsive experience. A new system update is available for Lenovo K8 Note. This update improves the overall stability and performance of the device. To install, please connect your Lenovo K8 Note to the internet and follow the following steps - Settings -> About Phone -> System Updates."
Electronics,100 and Genuine Launch X431 Main Test Cable X 431 Main Cable for Launch x431 Master GX3 Launch x431 main cable can work with launch x431 gx3 and master it is designed and produced by launch. Package list 1 pc x launch x431 main cable
