category,description
Books,"Biology (Pearson International Baccalaureate Diploma) Higher Level for Grade 11 & 12, 2nd Edition (Pearson International Baccalaureate Diploma: International Editions) About the Author Alan Damon: has taught science and computing at the Ecole Active Bilingue Jeannine Manuel in Paris since 1993, both in middle school and high school. He has taught IB Biology since 2003, taught IT in a Global Society for ten years and also currently teaches Theory of Knowledge. Randy McGonegal: has taught biology in the state of Florida for 40 years. He helped originate one of the first IB programmes in Florida in 1983 at St. Petersburg High School and still teaches IB Biology at nearby Palm Harbor University High School Randy has many years of experience as a workshop leader and examiner.Patricia Tosto: taught biology for 30 years. In 1983 she was instrumental in establishing the IB programme at Lincoln Park High School in Chicago, Illinois Currently, she is an examiner of internal Assessment and the Extended Essay. William Ward: has taught various classes involving biology for over 40 years. He has been involved with IB Biology since 1993 as a classroom instructor, workshop leader and examiner and has completed successful Group IV application for schools new to the IB programme"
Books,In Search of Ourselves An Introduction to Social Cultural Anthropology
Books,An Integrated Course in Electrical Engineering: With Theory and Objective Type Questions with Answers
Books,New Horizons of Public Administration 
Books,"LSAT Logic Games Bible (Powerscore Test Preparation) Review ""I'm an LSAT instructor with another national prep company. I think the Logic Games Bible is a great resource for students focused on excelling on the section. In fact, it was the buzz amongst my students that led me to purchase the Logic Games Bible for review on my own time."" -- Jenny Steiger ""www.powerscore.com""""I took a course from another company and found the PowerScore books to provide a far more practical strategy for the LSAT. I would recommend this book to anyone taking the test."" -- Jack Pratt ""www.powerscore.com""""I am writing this as an extremely satisfied consumer of your two ""bibles,"" the Logical Reasoning Bible and the Logic Games Bible. I just got my June 06 LSAT score back, and was pleasantly surprised to have received a 179. My initial diagnostic placed me at 153!"" -- Michael Wang ""powerscore.com"" 				    	 					 From the Inside Flap The PowerScore LSAT Logic Games Bible is the most comprehensive book available for the Logic Games section of the LSAT. This best-selling book will provide you with an advanced system for attacking any game that you may encounter on the LSAT. The concepts presented in the Logic Games Bible are representative of the techniques covered in PowerScore's live courses and have consistently been proven effective for thousands of students.  The Analytical Reasoning problems on the LSAT are often the most intimidating; however, once you understand how to construct an appropriate setup and make the necessary inferences, the solution to each question is quickly discovered. 				    	 					              See all Product description"
Books,"The Power of your Subconscious Mind Review It is an awesome book... psychological aspects of mind is expressed in an understandable manner. --ByRenjith Ravindranon 24 May 2017Must buy for everyone. Amazing book. I have just started reading it and completed first 2 chapters but. But i am highly immpressed with the example given in it and going to finish in next 3 days. --By A customer on 16 December 2015It's a very good n very useful book n it should be read by each n every one ...to knw the things that are not aware and know about the mind power .. Super duper book --ByAmazon Customeron 19 March 2017 				    	 					 About the Author Joseph Murphy was an American author and New Thought minister, ordained in Divine Science and Religious Science."
Books,Money purse -2 How to save money
Books,SBI & IBPS Bank PO Solved Papers - 40 papers (2010-2017) 
Books,"Freakonomics: A Rogue Economist Explores the Hidden Side of Everything About the Author About the Author: Steven D. Levitt is a professor of economy at the University of Chicago. He was awarded the John Bates Clark Medal for being the most influential economist under the age of forty. He has since co-authored a sequel to Freakonomics, Superfreakonomics. Stephen J. Dubner is a celebrated author, journalist and radio personality. in the past he taught English at the Columbia University. His journalism has been published with The New York Times, The New Yorker and The Time. He currently lives in New York with his wife and their children."
Books,Netter's Head and Neck Anatomy for Dentistry (Netter Basic Science) Review Your easy-access guide to clinically relevant anatomy for dentistry.
Books,The Literature Book: Big Ideas Simply Explained 
Books,"Why We Sleep: Unlocking the Power of Sleep and Dreams About the Author Matthew Walker is a professor of neuroscience and psychology at the University of California-Berkeley, the director of its sleep and neuroimaging laboratory, and a former professor of psychiatry at Harvard University. He has published over 100 scientific studies and has appeared on 60 Minutes, Nova, BBC News, and NPR's Science Friday."
Books,CBSE NCERT Solutions Mathematics 12  for 2018 - 19 
Books,General Studies - Paper I for Civil Services Preliminary Examination (2019) 
Books,A Textbook Of Public Health Dentistry PUBLIC HEALTH DENTISTRY
Books,"The Stokes Field Guide to the Birds of North America (Stokes Field Guides) Review ""Birders worldwide will eagerly welcome this comprehensive and all-inclusive new field guide from Donald and Lillian Stokes. Brimming with 3400 stunning photographs illustrating 854 species, this is unequivocally the most spectacular compendium of North American bird identification photographs ever assembled between two covers. ...this monumental volume offers birders the most up-to-date information on field identification of North American birds currently available. ...[it] significantly resets the bar for North America field guides.""―Wayne Petersen, Massachusetts Audubon Society""This is by far the most comprehensive North American field guide I have in my possession. [It] is so chock-full of quality photos, complete descriptions, maps and so forth...There are so many nice modern features that make this field guide extremely useful and user-friendly. I could go on and on...Yet another quality product from the Stokes, the endearing Ma & Pa of the birding world.""―Robert Mortensen, Idaho Birding Blog""[I]f one is going to own a photographic field guide for the birds of North America, the Stokes now have the most complete book on the market...The list of each species subspecies and hybrids is a wonderful touch; I can't think of any other field guide that ever included such information...you can't go wrong with this guide.""―Cory Finger, 10,000 Birds Blog""This is a glorious book put together with loving attention to detail...a superb, good-value field guide.""―Mark Cocker, BBC Wildlife""The Stokes Field Guide to the Birds of North America is an easy-to-use, superbly designed field guide that is detailed enough to be useful for birders of all experience levels. Highly recommended, this field guide is sure to be a delightful addition to any birder's library.""―About.com Birding Guide  Book Description The best, most comprehensive field guide to the birds of North America ever published, packaged with a bonus CD of 663 bird sounds from the most common birds. 				    	 					              See all Product description"
Books,"G TEWANI Calculus for JEE Advanced Cengage Publication, 2nd Edition Chapter 1 Functions Chapter 2 Limits Chapter 3 Continuity and Differentiability Chapter 4 Methods of Differentiation Chapter 5 Application of Derivatives Chapter 6 Monotonocity and Maxima–Minima of Functions Chapter 7 Indefinite Integration Chapter 8 Definite Integration Chapter 9 Area Chapter 10 Differential Equations Appendix A: Solutions Appendix B: Chapterwise Solved 2014 and 2015 JEE Advanced Questions Chapterwise Solved 2016 JEE Advanced Questions"
Books,Human Resource Management [Choice Based Credit System (CBCS)] (June 2016 Edition) [Choice Based Credit System (CBCS)]
Books,INDIAN CONSTITUTIONAL LAW : THE NEW CHALLENGES (SOLVED QUESTIONS & ANSWERS) [FOR LLM STUDENTS]
Books,"DSSSB Teacher Special Education Recruitment Exam 2017-18 About the Author An editorial team of highly skilled professionals at Arihant, works hand in glove to ensure that the students receive the best and accurate content through our books. From inception till the book comes out from print, the whole team comprising of authors, editors, proof-readers and various other involved in shaping the book put in their best efforts, knowledge and experience to produce the rigorous content the students receive. Keeping in mind the specific requirements of the students and various examinations, the carefully designed exam oriented and exam ready content comes out only after intensive research and analysis. The experts have adopted whole new style of presenting the content which is easily understandable, leaving behind the old traditional methods which once used to be the most effective. They have been developing the latest content and updates as per the needs and requirements of the students making our books a hallmark for quality and reliability for the past 15 years."
Books,"Handgun Training - Practice Drills for Defensive Shooting About the Author Grant Cunningham, Salem, OR, has written several titles for Gun Digest: Defensive Revolver Fundamentals, Gun Digest Book of the Revolver, Defensive Pistol Fundamentals and Gun Digest Shooter's Guide to Handguns. www.personalsecurity.us and www.grantcunningham.com."
Books,"Cracking the GRE Premium Edition with 6 Practice Tests, 2019: The All-in-One Solution for Your Highest Possible Score (Graduate School Test Preparation) About the Author The experts at The Princeton Review have been helping students, parents, and educators achieve the best results at every stage of the education process since 1981. In addition to helping millions succeed on standardized tests, The Princeton Review provides expert advice and instruction to help parents, teachers, students, and schools navigate the complexities of school admission. Along with classroom courses in over 40 states and 20 countries, The Princeton Review also offers online and school-based courses, one-to-one and small-group tutoring, and online services in both admission counseling and academic homework help."
Books,"Big Doctoring in America – Profiles in Primary Care (California/Milbank Books on Health and the Public) Review ""Mullan gets it right! His 'big doctors' are the unsung heroes of American medicine. Their stories - and they are great stories - tell us where we have to go to build a medical system that will work for everybody, And I mean everybody - the CEO, the family on welfare, you, and me."" - Studs Terkel, author of Working, The Good War, and Coming of Age"" 				    	 					 From the Inside Flap ""Mullan gets it right! His 'big doctors' are the unsung heroes of American medicine. Their stories and they are great storiestell us where we have to go to build a medical system that will work for everybody. And I mean everybody - the CEO, the family on welfare, you, and me.""Studs Terkel, author of Working, The Good War, and Coming of Age""Big Doctoring is a unique undertaking. We hear people in the frontlines of medicine tell us their story, and tell it in their own voices. In these pages, which are a joy to read, we find proof that medicine is, and always will be, both art and science.""Abraham Verghese, M.D., author of The Tennis Partner""Big Doctoring is an extraordinarily compelling effort by a dedicated and idealistic physician -- who offers us, through the voices of his informants, a clearly written narrative that tells of a profession's contemporary challenges and difficulties. Here is documentary work of the most instructive and telling kind -- a nation's healers become witnesses and teachers for us readers.""Robert Coles, M.D.""At a time when both doctors and patients in record numbers abhor the shadowy mass of gloomy economics and gruesome bureaucracy that has overtaken American medicine, Mullan shows us a path out of the darkness. And his is a desperately needed map, as physicins and nurses are now quitting in droves, tens of millions of Americans are losing their health insurance, and millions more, though insured, are forbidden treatments and primary care that could save their lives. Bravo!""Laurie Garrett, author of The Coming Plague and Betrayal of Trust              See all Product description"
Books,Objective Environment & Ecology for Civil Services Preliminary Examination 2018 
Books,GATE 2019: Mechanical Engineering - Previous Solved Papers 
Books,Environment Revised Edition 
Books,"40 Years Chapterwise Topicwise Solved Papers (2018-1979) IIT JEE Chemistry About the Author An editorial team of highly skilled professionals at Arihant, works hand in glove to ensure that the students receive the best and accurate content through our books. From inception till the book comes out from print, the whole team comprising of authors, editors, proof-readers and various other involved in shaping the book put in their best efforts, knowledge and experience to produce the rigorous content the students receive. Keeping in mind the specific requirements of the students and various examinations, the carefully designed exam oriented and exam ready content comes out only after intensive research and analysis. the experts have adopted whole new style of presenting the content which is easily understandable, leaving behind the old traditional methods which once used to be the most effective. They have been developing the latest content and updates as per the needs and requirements of the students making our books a hallmark for quality and reliability for the past 15 years."
Books,"Squirrel Products 20 Assorted Rock Climbing Holds with Hardware -Jungle Gym or Swing Set Accessory Climbing holds, come in different size and different shape These climbing holds have a rock like feel to them Our holds are very strong and will stand up to any climate for any climbing wall, simply screw on your wall Suitable for both children and adult Create a place for you and your children, where you can have fun, improve your fitness, coordination and muscle strength These holds are nontoxic, tasteless, environmentally friendly, stable, durable and can be used for a long time."
Books,"Generic Silicone Simulation Live Shrimp Fishing Soft Prawn Lure Hook Bait Tackle Description:  Material: Silicone Length: Approx. 10cm/3.94 inch Color: As picture show Strong and sharp, like the real shrimp. Unique movement as life-like swimming action in water. Ideal for fishing, the shrimp is suitable for different kinds of fishes, like Snakehead, bass, mandarin fish, pond lice, red tip, fork-tail madtoms etc.   ?  Package Includes:  1x Fishing Lure Bait"
Books,"Open Veins of Latin America: Five Centuries of the Pillage of a Continent Review This book is a monument in our Latin American history. It allows us to learn history, and we have to build on this historyI cannot recommend this book highly enough. Galeano's vision is unswerving, surgical and yet immensely generous and humane ... Eduardo Galeano ought to be a household nameHe has more first-hand knowledge of Latin America than anybody else I can think of, and uses it to tell the world of the dreams and disillusions, the hopes and failures of its people... Galeano denounces exploitation with uncompromising ferocity, yet this book is almost poetic in its description of solidarity and human capacity for survival in the midst of the worst kind of despoilationRemains pertinent nearly 40 years on... Impassioned and lucid, Galeano is a knowledgeable guide through a shameful history of foreign exploitation... If he needs a primer on his southern neighbours, Obama could do worse than studying Chavez's presentA valuable study 				    	 					 Book Description The book Chavez gave Obama... the ensuing media frenzy... the hottest book written about the coolest continent 				    	 					              See all Product description"
Books,"Contemporary Political Theory About the Author M. J. Vinod, Ph.D., is Professor in the Department of Political Science at Bangalore University, Bangalore. He has thirty years of teaching and research experience and has been teaching the paper on “Political Theory” for many years now. He has been a Salzburg Fellow, Ford Foundation Fellow, Swiss Foreign Ministry Fellow to the Graduate School of International Studies and a Visiting Fellow at the Henry L. Stimson Center, Washington D. C. He has written many monographs and published widely in academic journals from India and abroad. Professor Vinod has authored three other books titled Security Challenges in the Asia-Pacific Region: The Taiwan Factor (2009), Indian Foreign Policy in the 21st Century: Challenges and Opportunities (2006) and United States Foreign Policy Towards Indi A Study of the American Approach (1999). His research expertise includes India-United States relations, nuclear-related issues, South Asian security research, Indian foreign policy and political theory. He has recently completed a major research project with the UGC on “Migrations into Bangalore City: A Study of Its Social, Economic and Political Implications. ” Meena Deshpande, PhD, is Professor of Thought and Theory in the Department of Political Science at Bangalore University, Bangalore. She has thirty years of teaching and research experience and has been a visiting fellow at the Institute for Industrial Development, New Delhi. She has also co-authored a book titled Contemporary Political Theory in Kannada. Since 1996, Dr. Deshpande is associated with the Project of Bharatiya Vidya Bhavan, Bangalore, as an Editor for translating the Collected Works of Mahatma Gandhi (100 volumes) into Kannada, language of the state. So far 24 volumes have been published. She has been a course writer for IGNOU, New Delhi for the PG course on Gandhian Philosophy. She has published articles in various accredited journals. Her areas of specialization are political thought and theory, Gandhian studies and gender studies."
Books,"The Five Love Languages of Children Review This outstanding book addresses how each child (adults as well) expresses and receives love best through one of five primary ""languages"" - quality time, words of affirmation, gifts, acts of service, or physical touch. Although children need to be spoken to in each of these love languages, there's one love language that meets their deepest emotional needs and should be used often with them (and authors caution how you use that language for discipline). The information in this book complements books that address communicating with children based on their temperament (such as ""Raising your Spirited Child"" and ""Kids, Parents, and Power Struggles"" by Mary Sheedy Kurcinka). I also appreciate that the author included an informative chapter on ""love languages in marriage"", instead of just a one-liner encouraging readers to buy his book dedicated to that subject. Bottom line - Even if you've read tons of parenting books, you will truly learn something new from this one - something to enhance your relationship with your child and adults in your life. You'll probably even learn something about yourself. --By Nature Mom w/ 2 children 25 July 2001This book has revolutionised the way I communicate with, and discipline my children. Within the space of three days my three year old has gone from being difficult for me to deal with to being a pleasant child who responds to discipline in a positive manner. Our home has become more of a haven than a battlefield! Learning to communicate with my children in their primary love language has been the BEST thing that has happened to my parenting, and to their self esteem. I would highly recommend this book to any parent of young children. I will certainly be re-reading it through the years of their lives. --By A Customer 15 March 2000Listening to the audio version of this excellent book is a great use of your time while driving to work. The five love languages concepts and how to apply them in raising and loving your children and even improving your marriage are eye-opening and thought-provoking. I believe I will listen to this tape again and again over the years as I raise my young daughter. I highly recommend the audio version for all young, busy families! --By A Customer 5 August 1999 				    	 					 About the Author Gary Chapman is a relationship counselor and author of the The 5 Love Languages series. He is the director of Marriage and Family Life Consultants, Inc. He also has a radio program on marriage and relationships that airs on over 100 stations and can be heard via the internet.He is a graduate of the Moody Bible Institute and holds a Bachelor of Arts (B.A.) and Master of Arts (M.A.) degree in anthropology from Wheaton College and from Wake Forest University. He also received Master of Religious Education (M.R.E.) and Doctor of Philosophy (Ph.D.) degrees from Southwestern Baptist Theological Seminary"
Books,URVI Creations Pack of 20 Natural Peacock Feather/Mor Pankh/Real Peacock Feather for Home Decor/Good Luck/Art and Craft/Worship atural Peacock Feather /Mor Pankh / Real Peacock Feather For Home Decor /Good Luck /Art and Craft /Worship
Books,One-straw Revolution: Introduction to Natural Farming Language Notes Text: English (translation) Original Language: Japanese
Books,ORACLE PL/SQL: Interview Questions You'll Most Likely Be Asked: Volume 12 (Job Interview Questions) 
Books,Gate Guide Computer Science and Information Technology 2019 
Books,"Hacking Android About the Author Srinivasa Rao Kotipalli (@srini0x00) is a security researcher from India. He has extensive hands-on experience in performing web application, infrastructure, and mobile security assessments. He worked as a security consultant at Tata Consultancy Services India for two and a half years and later joined a start-up in Malaysia. He has delivered training sessions on web, infrastructure, and mobile penetration testing for organizations across the world, in countries such as India, Malaysia, Brunei, and Vietnam. Through responsible disclosure programs, he has reported vulnerabilities in many top-notch organizations. He holds a bachelor's degree in information technology and is OSCP certified. He blogs at www.androidpentesting.com and www.infosecinstitute.com. Mohammed A. Imran (@secfigo) is an experienced application security engineer and the founder of null Singapore and null Hyderabad. With more than 6 years of experience in product security and consulting, he spends most of his time on penetration testing, vulnerability assessments, and source code reviews of web and mobile applications. He has helped telecom, banking, and software development houses create and maintain secure SDLC programs. He has also created and delivered training on application security and secure coding practices to students, enterprises, and government organizations. He holds a master's degree in computer science and is actively involved in the information security community and organizes meetups regularly."
Books,"Feeling GooD: The New Mood Therapy Review ""A BOOK TO READ AND RE-READ!"" -- Los Angeles Times ""A book to read and re-read!"" ""-Los Angeles Times"" 				    	 					 From the Back Cover The good news is that anxiety, guilt, pessimism, procrastination, low self-esteem, and other ""black holes"" of depression can be cured without drugs. In FEELING GOOD, eminent psychiatrist, David D. Burns, M.D., outlines the remarkable, scientifically proven techniques that will immediately lift your spirits and help you develop a positive outlook on life. Now, in this updated edition, Dr. Burns adds an ALL-NEW CONSUMER'S GUIDE TO ANTIDEPRESSANT DRUGS as well as a new introduction to help answer your questions about the many options available today for treating depression.-- Recognize what causes your mood swings-- Nip negative feelings in the bud-- Deal with guilt-- Handle hostility and criticism-- Overcome addiction to love and approval-- Build self-esteem-- Feel good every day 				    	 					              See all Product description"
Books,"The Earth Science Book: Activities for Kids From the Publisher Contains dozens of fun-filled, educational and easy-to-do experiments which help explain basic earth science facts and environmental issues. Coverage includes the force of gravity, parts of the Earth, continents and islands, caring for land, water and the Earth's atmosphere, plants, animals, fossils, investigating fungi and bacteria, photosynthesis and much more. A significant amount of illustrations will make it extremely attractive to children. 				    	 					 From the Back Cover If you?re looking for the most fun on Earth?Make your own fossils (pg. 39)Create a tsunami in your bathtub (pg. 45)Watch a volcano erupt (pg. 47)Follow the path of a mini-glacier (pg. 73)No other book on Earth science is packed with so much fun. The Earth Science Book?s pages overflow with dozens and dozens of enjoyable, educational, and easy-to-do activities that explain basic Earth science facts and important environmental issues. Using simple materials you can find around the house or in your neighborhood, these activities show you all about the planet Earth, its composition and atmosphere, life on Earth, and much more. 				    	 					         		         		         	                                                                                   See all Product description"
